<?xml version="1.0"?>
<xsd:schema xmlns:xsd="http://www.w3.org/2001/XMLSchema" elementFormDefault="qualified">
    <xsd:element name="data-crow-objects">
    <xsd:complexType>
        <xsd:sequence>
            <xsd:element name="music_album_state-items" type ="music_album_state-items-type"/>
        </xsd:sequence>
    </xsd:complexType>
</xsd:element>

    <xsd:complexType name="music_album_state-items-type" >
        <xsd:sequence>
            <xsd:element type="music_album_state-type" name="music_album_state" maxOccurs="unbounded"/>
        </xsd:sequence>
    </xsd:complexType>

    <xsd:complexType name="music_album_state-type" >
        <xsd:sequence>
            <xsd:element name="picture-01" type="xsd:string" nillable="true" minOccurs="0"/>
            <xsd:element name="picture-02" type="xsd:string" nillable="true" minOccurs="0"/>
            <xsd:element name="picture-03" type="xsd:string" nillable="true" minOccurs="0"/>
            <xsd:element name="picture-04" type="xsd:string" nillable="true" minOccurs="0"/>
            <xsd:element name="picture-05" type="xsd:string" nillable="true" minOccurs="0"/>
            <xsd:element name="picture-06" type="xsd:string" nillable="true" minOccurs="0"/>
            <xsd:element name="picture-07" type="xsd:string" nillable="true" minOccurs="0"/>
            <xsd:element name="picture-08" type="xsd:string" nillable="true" minOccurs="0"/>
            <xsd:element name="picture-09" type="xsd:string" nillable="true" minOccurs="0"/>
            <xsd:element name="picture-10" type="xsd:string" nillable="true" minOccurs="0"/>
            <xsd:element name="name" type="xsd:string" nillable="true" minOccurs="0"/>
            <xsd:element name="alternative-names" type="xsd:string" nillable="true" minOccurs="0"/>
            <xsd:element name="modified" type="xsd:date" nillable="true" minOccurs="0"/>
            <xsd:element name="created" type="xsd:date" nillable="true" minOccurs="0"/>
            <xsd:element name="icon" type="xsd:string" nillable="true" minOccurs="0"/>
            <xsd:element name="item" type="xsd:string" nillable="true" minOccurs="0"/>
            <xsd:element name="label" type="xsd:string" nillable="true" minOccurs="0"/>
            <xsd:element name="id" type="xsd:string" nillable="true" minOccurs="0"/>
        </xsd:sequence>
    </xsd:complexType>
</xsd:schema>
